<?xml version="1.0" encoding="UTF-8" ?> 
<MetamodelInf xmlns="http://sap.com/moin/MoinArchive"
  xmlns:xsi="http://www.w3.org/2001/XMLSchema-instance"
  xsi:schemaLocation="http://sap.com/moin/MoinArchive metamodel_inf.xsd">
  <FacilityId>PF</FacilityId>
  <DeploymentExtension class="com.sap.tc.moin.package63449DD06F4F452037E675FD83797A4B78F083F4.MetamodelExtension" />
  <Partitions>
    <Partition name="moin/meta/toplevel2.moinmm"
      contentHash="1220510575453" />
    <Partition name="moin/meta/testcasesMofElement.moinmm"
      contentHash="1220510575484" />
    <Partition name="moin/meta/testcases.moinmm"
      contentHash="1220510575500" />
    <Partition name="moin/meta/toplevel3.moinmm"
      contentHash="1220510575468" />
    <Partition name="moin/meta/toplevel1.moinmm"
      contentHash="1220510575437" />
  </Partitions>
</MetamodelInf>
